{"kind":"quota","material_unpriced":false,"operator_notification_required":false,"policy_sha256":"5c8fb50b0bc3c771425b636b2a4aee965550c05017b349351d50051e315341d1","policy_version":"2026-08-21.3","providers":{"anthropic":{"content_type":"text/plain","elapsed_class":"bounded","failure_class":null,"final_url_sha256":"0834703da13ba8a226373a44bbea68a9786215127c61eada97f76f1b9887e302","last_successful_official_date":"2026-08-20","material_share_basis_points":2500,"original_last_good_date":null,"provider":"anthropic","redirect_chain_sha256":"c7826311935a0832e9a30e8e1d4e8e81562febd69f945b823200690b2f7cf31e","retrieved_date":"2026-08-20","source_url_sha256":"0834703da13ba8a226373a44bbea68a9786215127c61eada97f76f1b9887e302","status":"official","value_sha256":"ad2c05725d090d8d317dab436f78970ec9e82c1c11f9a2ecf8e61251e1ce1569","values":[{"approved_value_sha256":"dbda9def8f8b428b042b0e5db3198a535e51dfdd48dee93efb937dc2a91da67e","cooldown_seconds":0,"limit_kind":"rpm","limit_value":120,"modality":"text","model":"model-a","modifiers":["none"],"record_id":"standard-rpm","tier":"standard","window_seconds":60}]},"google":{"content_type":"text/plain","elapsed_class":"bounded","failure_class":null,"final_url_sha256":"20ebf13c26b64b4167c7af9ac0df13cddef937317e5f360b586f90145972a0f7","last_successful_official_date":"2026-08-20","material_share_basis_points":2500,"original_last_good_date":null,"provider":"google","redirect_chain_sha256":"698531d0fa32bb7aa945635299fc741bfbb7b934bab2b7cc8797357b97a746f8","retrieved_date":"2026-08-20","source_url_sha256":"20ebf13c26b64b4167c7af9ac0df13cddef937317e5f360b586f90145972a0f7","status":"official","value_sha256":"ad2c05725d090d8d317dab436f78970ec9e82c1c11f9a2ecf8e61251e1ce1569","values":[{"approved_value_sha256":"dbda9def8f8b428b042b0e5db3198a535e51dfdd48dee93efb937dc2a91da67e","cooldown_seconds":0,"limit_kind":"rpm","limit_value":120,"modality":"text","model":"model-a","modifiers":["none"],"record_id":"standard-rpm","tier":"standard","window_seconds":60}]},"openai":{"content_type":"text/plain","elapsed_class":"bounded","failure_class":null,"final_url_sha256":"0f6a8298951003ddf3f510c079f90b55f4093b9536bc780369c6f3b574597f1a","last_successful_official_date":"2026-08-20","material_share_basis_points":2500,"original_last_good_date":null,"provider":"openai","redirect_chain_sha256":"be0c6a2e32e6605e549713488759f5b5771c1c4d59e4df2b10bccf395be27a4d","retrieved_date":"2026-08-20","source_url_sha256":"0f6a8298951003ddf3f510c079f90b55f4093b9536bc780369c6f3b574597f1a","status":"official","value_sha256":"ad2c05725d090d8d317dab436f78970ec9e82c1c11f9a2ecf8e61251e1ce1569","values":[{"approved_value_sha256":"dbda9def8f8b428b042b0e5db3198a535e51dfdd48dee93efb937dc2a91da67e","cooldown_seconds":0,"limit_kind":"rpm","limit_value":120,"modality":"text","model":"model-a","modifiers":["none"],"record_id":"standard-rpm","tier":"standard","window_seconds":60}]},"xai":{"content_type":"text/plain","elapsed_class":"bounded","failure_class":null,"final_url_sha256":"b0b910582930dfe6db7ca145611ee7ccf42eb548a638875e2867e5649354a83c","last_successful_official_date":"2026-08-20","material_share_basis_points":2500,"original_last_good_date":null,"provider":"xai","redirect_chain_sha256":"8fc7d4d6f12b91a4d016a6718772bc5b098eb122f509c5f3fb2cbf2c8cebaa3f","retrieved_date":"2026-08-20","source_url_sha256":"b0b910582930dfe6db7ca145611ee7ccf42eb548a638875e2867e5649354a83c","status":"official","value_sha256":"ad2c05725d090d8d317dab436f78970ec9e82c1c11f9a2ecf8e61251e1ce1569","values":[{"approved_value_sha256":"dbda9def8f8b428b042b0e5db3198a535e51dfdd48dee93efb937dc2a91da67e","cooldown_seconds":0,"limit_kind":"rpm","limit_value":120,"modality":"text","model":"model-a","modifiers":["none"],"record_id":"standard-rpm","tier":"standard","window_seconds":60}]}},"retrieved_date":"2026-08-20","schema_version":1,"uncertainty_basis_points":0}