{"kind":"quota","material_unpriced":false,"operator_notification_required":true,"policy_sha256":"a492f67da8c68b1b5a72e9a9670a2d11d1a6edc32b2d872905eeeb25231ffcc5","policy_version":"2026-10-19.1","providers":{"anthropic":{"content_type":null,"elapsed_class":null,"failure_class":"no_reviewed_value","final_url_sha256":null,"last_successful_official_date":null,"material_share_basis_points":0,"original_last_good_date":null,"provider":"anthropic","redirect_chain_sha256":null,"retrieved_date":null,"source_url_sha256":null,"status":"unknown","value_sha256":null,"values":[]},"google":{"content_type":null,"elapsed_class":null,"failure_class":"no_reviewed_value","final_url_sha256":null,"last_successful_official_date":null,"material_share_basis_points":0,"original_last_good_date":null,"provider":"google","redirect_chain_sha256":null,"retrieved_date":null,"source_url_sha256":null,"status":"unknown","value_sha256":null,"values":[]},"openai":{"content_type":null,"elapsed_class":null,"failure_class":"no_reviewed_value","final_url_sha256":null,"last_successful_official_date":null,"material_share_basis_points":0,"original_last_good_date":null,"provider":"openai","redirect_chain_sha256":null,"retrieved_date":null,"source_url_sha256":null,"status":"unknown","value_sha256":null,"values":[]},"xai":{"content_type":null,"elapsed_class":null,"failure_class":"no_reviewed_value","final_url_sha256":null,"last_successful_official_date":null,"material_share_basis_points":0,"original_last_good_date":null,"provider":"xai","redirect_chain_sha256":null,"retrieved_date":null,"source_url_sha256":null,"status":"unknown","value_sha256":null,"values":[]}},"retrieved_date":"2026-10-19","schema_version":1,"uncertainty_basis_points":3000}