{"schema_version":1,"kind":"quota","policy_version":"policy-v1","policy_sha256":"aaaaaaaaaaaaaaaaaaaaaaaaaaaaaaaaaaaaaaaaaaaaaaaaaaaaaaaaaaaaaaaa","retrieved_date":"2026-08-20","providers":{"provider-a":{"provider":"provider-a","status":"official","retrieved_date":"2026-08-20","last_successful_official_date":"2026-08-20","original_last_good_date":null,"values":[{"record_id":"q1","model":"m","modality":"text","tier":"standard","limit_kind":"tpm","limit_value":1000000,"window_seconds":60,"cooldown_seconds":0,"modifiers":[],"approved_value_sha256":"aaaaaaaaaaaaaaaaaaaaaaaaaaaaaaaaaaaaaaaaaaaaaaaaaaaaaaaaaaaaaaaa"}],"value_sha256":"aaaaaaaaaaaaaaaaaaaaaaaaaaaaaaaaaaaaaaaaaaaaaaaaaaaaaaaaaaaaaaaa","source_url_sha256":"aaaaaaaaaaaaaaaaaaaaaaaaaaaaaaaaaaaaaaaaaaaaaaaaaaaaaaaaaaaaaaaa","final_url_sha256":"aaaaaaaaaaaaaaaaaaaaaaaaaaaaaaaaaaaaaaaaaaaaaaaaaaaaaaaaaaaaaaaa","redirect_chain_sha256":"aaaaaaaaaaaaaaaaaaaaaaaaaaaaaaaaaaaaaaaaaaaaaaaaaaaaaaaaaaaaaaaa","content_type":"text/html","elapsed_class":"fast","failure_class":null,"material_share_basis_points":10000}},"operator_notification_required":false,"material_unpriced":false,"uncertainty_basis_points":0}
